[
  {
    "request_id": "req_01ARZ3NDEKTSV4RRFFQ69G5FAX",
    "execution_id": "exec_01ARZ3NDEKTSV4RRFFQ69G5FAY",
    "tier": "agent_asserted",
    "action": "write_file",
    "issued_at": "2026-08-17T13:57:01.000Z",
    "payload_sha256": "e3b0c44298fc1c149afbf4c8996fb92427ae41e4649b934ca495991b7852b855"
  }
]
